SNY,75008,Healthcare,99412,"Sanofi, a healthcare company, engages in the research, development, manufacture, and marketing of therapeutic solutions in the United States, Europe, and internationally. It operates through three segments: Pharmaceuticals, Vaccines, and Consumer Healthcare. The company provides specialty care products, including human monoclonal antibodies; products for multiple sclerosis, neurology, other inflammatory diseases, immunology, rare diseases, oncology, and rare blood disorders; medicines for diabetes; and cardiovascular and established prescription products. It also supplies poliomyelitis, pertussis, and hib pediatric vaccines; and influenza, adult booster, meningitis, and travel and endemic vaccines. In addition, the company offers allergy, cough and cold, pain, digestive, and nutritional products; and other products, such as daily body lotions, anti-itch products, moisturizing and soothing lotions, and body and foot creams, as well as powders for eczema. It also has various pharmaceutical products and vaccines in development stage. Sanofi has collaboration agreement with GlaxoSmithKline to develop a recombinant Covid-19 vaccine; and a research collaboration with Stanford University School of Medicine to advance the understanding of immunology and inflammation through open scientific exchange. It also has a collaboration with TrialSpark Inc. to execute clinical research studies in the areas of chronic obstructive pulmonary disease. The company was formerly known as Sanofi-Aventis and changed its name to Sanofi in May 2011. Sanofi was incorporated in 1994 and is headquartered in Paris, France.",Paris,33 1 53 77 40 00,,France,[],http://www.sanofi.com,1,"54, Rue La BoEtie",Drug Manufacturers—General,0.28636998,0.15472001,0.67671996,8277000192,0.072,0.21515,10752000000,57,strong_buy,25265000000,6238249984,62,49.01,-0.841,1.546,0.044260003,5,63.4,34.166,0.092159994,71,9722000384,21649000448,37546000384,3.881,EUR,14.9835,0.896,1,NMS,Sanofi,Sanofi,America/New_York,EDT,False,-14400000,,EQUITY,,,finmb_687130,9bce3a62-a870-318f-b183-dd2320b9b6fd,us_market,,3.799,,13.267,,,4.39,,2501489920,,,,25.1865,4435386,0.0018000001,,1609372800,0.08185001,5808999936,5.778,,,1.9458836,0,1672444800,,1625011200,2.71,1626307200,2223802125,0.397377,142643380224,2,,1380499200,5:1,,,-0.841,3.265275,1628812800,1.86,,11.164009,,,3927965,,,48.6,48.89,51.279423,0.06584363,0.6913,,49.02,,1207971,48.6,49.56147,3.2,48.89,1207971,,,1.93,1620000000,,,48.69,USD,8.482174,1059317,,,,122598014976,,,1981964,48.69,48.99,800,1059317,54.26,,3.84,44.76,47.2,False,0.037,2900,49.02,49.01,https://logo.clearbit.com/sanofi.com,,33 1 53 77 43 03
NOW,95054,Technology,13096,"ServiceNow, Inc. provides enterprise cloud computing solutions that defines, structures, consolidates, manages, and automates services for enterprises worldwide. It operates the Now platform that offers workflow automation, artificial intelligence, machine learning, performance analytics, electronic service catalogs and portals, configuration management systems, data benchmarking, encryption, and collaboration and development tools. The company also provides information technology (IT) service management applications; IT service management product suite for enterprise's employees, customers, and partners; IT business management product suite to manage IT priorities; IT operations management product that connects a customer's physical and cloud-based IT infrastructure; IT Asset Management to automate IT asset lifecycles; and enterprise development operations product for developers' toolchain. In addition, it offers security incident management, threat enrichment intelligence, vulnerability response management, and security incident intelligence sharing security operation products; governance, risk, and compliance product to create policies and controls; human resources, legal, and workplace service delivery products; safe workplace applications; customer service management product; and field service management applications. Further, it provides App Engine product; IntegrationHub enables application to extend workflows; and professional, training, and customer support services. It serves government, financial services, healthcare, telecommunications, manufacturing, IT services, technology, oil and gas, education, and consumer products. It sells its products through direct sales team and resale partners. The company was formerly known as Service-now.com and changed its name to ServiceNow, Inc. in May 2012. The company was incorporated in 2004 and is headquartered in Santa Clara, California.",Santa Clara,408-501-8550,CA,United States,[],http://www.servicenow.com,1,2225 Lawson Lane,Software—Application,0.12245,0.03297,0.77586,1953598976,0.316,0.04542,633244032,466.8,buy,3532371000,2069946112,650,617.58,0.45,1.081,0.01869,31,656.45,63.786,0.059270002,765,2984000000,2088999936,5171484160,15.06,USD,26.34,0.963,1.7,NYQ,"ServiceNow, Inc.","ServiceNow, Inc.",America/New_York,EDT,True,-14400000,,EQUITY,,,finmb_22967487,3dce1fce-9ac0-3d13-89df-bd9186289385,us_market,,24.77,,202.287,,,7.08,,197448000,,,,15.381,3682730,0.0186,,1609372800,0.89139,170503008,0.76,,,40.152138,0.00379,1672444800,,1625011200,4.22,1627603200,197459360,0.920851,128096829440,2,,,,,,0.439,23.579292,1630368000,4.6,,87.22881,,0.0186,4131919,,,637.92,640,556.5922,,0,,643.66,,1144642,637.92,641.72,,640,1144642,,,,,,,616.92,USD,812.6053,1557175,,,,121939935232,,,1016262,616.92,623.76,1400,1557175,681.1,,,448.27,618.13,False,,1000,643.66,617.58,https://logo.clearbit.com/servicenow.com,,
JD,101111,Consumer Cyclical,310000,"JD.com, Inc. operates as an e-commerce company and retail infrastructure service provider in the People's Republic of China. It operates in two segments, JD Retail and New Businesses. The company offers home appliances; mobile handsets and other digital products; desktop, laptop, and other computers, as well as printers and other office equipment; furniture and household goods; apparel; cosmetics, personal care items, and pet products; women's shoes, bags, jewelry, and luxury goods; men's shoes, sports gears, and fitness equipment; automobiles and accessories; maternal and childcare products, toys, and musical instruments; and food, beverage, and fresh produce. It also provides gifts, flowers, and plants; pharmaceutical and healthcare products, including OCT pharmaceutical products, nutritional supplements, healthcare services, and other healthcare equipment; books, e-books, music, movie, and other media products; and virtual goods, such as online travel agency, attraction tickets, and prepaid phone and game cards, as well as industrial products and installation and maintenance services. In addition, the company offers an online marketplace for third-party merchants to sell products to customers; and transaction processing and billing, and other services. Further, it provides online marketing services for suppliers, third-party merchants, and other business partners; supply chain and logistics services for various industries; and consumer financing services to individual customers, as well as online-to-offline solutions. JD.com, Inc. offers its products through its website jd.com and mobile apps, as well as directly to customers. As of December 31, 2020, JD.com, Inc. operated fulfillment centers with a network of approximately 900 warehouses in various counties and districts in China. The company has strategic cooperation agreement with Tencent Holdings Limited. JD.com, Inc. was incorporated in 2006 and is headquartered in Beijing, China.",Beijing,,,China,[],http://www.jd.com,1,Building A,Internet Retail,0.020280002,0.06471,0.07921,36578021376,0.39,0.0124,16280725504,61.95,buy,60408124000,6688770048,95.6,78.61,2.139,1.403,0.01827,40,94.75,14.528,0.31530002,124.89,134878658560,32848750592,802772877312,87.19,CNY,523.495,0.936,1.8,NMS,"JD.com, Inc.","JD.com, Inc.",America/New_York,EDT,False,-14400000,,EQUITY,,,finmb_36273923,2ecd214d-b016-30ad-a345-2ae4236e065d,us_market,,0.061,,2.998,,,2.42,,1558989952,,,,121.964,28268787,0.018099999,,1609372800,0.42067,51949686784,5.081,,,0.64453447,0.07018,1672444800,,1617148800,2.51,1619740800,909702945,0.760326,48802496512,2,,,,,,2.372,0.15266111,1622160000,102.7,,32.48347,,,28810782,,,76.3,76.84,74.7209,,0,,78.95,,9315528,76.3,76.15691,,76.84,9315528,,,,,,,76.12,USD,15.471364,10831529,,,,122552197120,,,11582334,76.12,78.88,1800,10831529,108.29,,,61.65,78.62,False,,3000,78.95,78.61,https://logo.clearbit.com/jd.com,"20th Floor No. 18 Kechuang 11 Street Yizhuang Eco & Tech Dev Zn, Daxing Dist.",
DIS,91521,Communication Services,170000,"The Walt Disney Company, together with its subsidiaries, operates as an entertainment company worldwide. The company's Media Networks segment operates domestic cable networks under the Disney, ESPN, Freeform, FX, and National Geographic brands; and television broadcast network under the ABC brand, as well as eight domestic television stations. This segment is also involved in the television production and distribution. Its Parks, Experiences and Products segment operates theme parks and resorts, such as Walt Disney World Resort in Florida; Disneyland Resort in California; Disneyland Paris; Hong Kong Disneyland Resort; and Shanghai Disney Resort; Disney Cruise Line, Disney Vacation Club, National Geographic Expeditions, and Adventures by Disney and Aulani, a Disney resort and spa in Hawaii, as well as licenses its intellectual property to a third party for the operations of the Tokyo Disney Resort in Japan. The company's Studio Entertainment segment produces and distributes motion pictures under the Walt Disney Pictures, Twentieth Century Studios, Marvel, Lucasfilm, Pixar, Searchlight Pictures, and Blue Sky Studios banners; develops, produces, and licenses live entertainment events; produces and distributes music; and provides post-production services through Industrial Light & Magic and Skywalker Sound. Its Direct-To-Consumer & International segment operates international television networks and channels comprising Disney, ESPN, Fox, National Geographic, and Star; direct-to-consumer videos streaming services consisting of Disney+/Disney+Hotstar, ESPN+, and Hulu; and operates branded apps and Websites, such as Disney Movie Club and Disney Digital Network, as well as provides streaming technology support services. The company was founded in 1923 and is based in Burbank, California.",Burbank,818-560-1000,CA,United States,[],http://www.thewaltdisneycompany.com,1,500 South Buena Vista Street,Entertainment,0.111379996,-0.07735,0.30647,4298999808,-0.134,0.02086,6498999808,147,buy,21508000000,3945750016,215,176.74,0.942,1.234,0.00374,26,210.23,56.601,-0.03924,230,15889999872,56146001920,58347999232,8.746,USD,32.201,1.067,1.9,NYQ,Walt Disney Company (The),The Walt Disney Company,America/New_York,EDT,True,-14400000,,EQUITY,,,finmb_191564,aef70f8f-79be-3478-9d04-39acf5bad0ef,us_market,,6.384,,57.313,,,5.02,,1816930048,,,,47.078,21982594,0.0121,,1601683200,0.66678,-4487000064,-2.491,,,3.7541955,0.00124,1664755200,,1617408000,2.27,1619740800,1814987941,1.196195,372474707968,2,,1181692800,10000:9865,,,0.959,5.5036035,1622160000,1.46,,35.207172,,0.0121,21514372,,,177.71,177.93,179.16785,0.0049518878,0,,178.6,,8291771,177.71,178.85883,0.88,177.93,8291771,,,,1576195200,,,176.4029,USD,,3950225,,,,321124237312,,,8427543,176.4029,176.97,800,3950225,203.02,,,117.23,176.5,False,,800,178.6,176.74,https://logo.clearbit.com/thewaltdisneycompany.com,,
NVDA,95051,Technology,18975,"NVIDIA Corporation operates as a visual computing company worldwide. It operates in two segments, Graphics and Compute & Networking. The Graphics segment offers GeForce GPUs for gaming and PCs, the GeForce NOW game streaming service and related infrastructure, and solutions for gaming platforms; Quadro/NVIDIA RTX GPUs for enterprise design; GRID software for cloud-based visual and virtual computing; and automotive platforms for infotainment systems. The Compute & Networking segment offers Data Center platforms and systems for AI, HPC, and accelerated computing; Mellanox networking and interconnect solutions; automotive AI Cockpit, autonomous driving development agreements, and autonomous vehicle solutions; and Jetson for robotics and other embedded platforms. The company's products are used in gaming, professional visualization, datacenter, and automotive markets. NVIDIA Corporation sells its products to original equipment manufacturers, original device manufacturers, system builders, add-in board manufacturers, retailers/distributors, Internet and cloud service providers, automotive manufacturers and tier-1 automotive suppliers, mapping companies, start-ups, and other ecosystem participants. NVIDIA has partnership with Google Cloud to create AI-on-5G Lab. NVIDIA Corporation was founded in 1993 and is headquartered in Santa Clara, California.",Santa Clara,408 486 2000,CA,United States,[],http://www.nvidia.com,1,2788 San Tomas Expressway,Semiconductors,0.38759,0.32324,0.63758,7902000128,0.683,0.33488998,8487000064,110,buy,10557000000,4634250240,230,208.31,2.76,5.802,0.1436,41,226.4,60.486,0.40375,300,19654000640,12791000064,21897000960,7.862,USD,8.821,5.225,2,NMS,NVIDIA Corporation,NVIDIA Corporation,America/New_York,EDT,True,-14400000,,EQUITY,,,finmb_32307,7f5f6a07-b148-30f4-98a2-2caa3df2aed0,us_market,,25.35,,65.404,,,17.24,,623000000,,,,30.135,24041114,0.0095999995,,1612051200,0.66455,7078000128,8.46,,,6.91256,0.04079,1675123200,,1627776000,0.82,1627603200,2398975000,1.359716,555086970880,2,,1626739200,4:1,,,2.817,5.926708,1630368000,1.66,,12.082947,,0.01,29954260,,,210.75,211.01,182.69186,0.0030367733,0.0572,,212.06,,25597785,210.75,217.62941,0.64,211.01,25597785,,,0.16,1630368000,,,207.75,USD,24.62293,14676150,,,,129777131520,,,28623739,207.75,208,800,14676150,230.43,,0.29,115.665,207.8,False,0.0007,800,212.06,208.31,https://logo.clearbit.com/nvidia.com,,
PDD,200051,Consumer Cyclical,7986,"Pinduoduo Inc., through its subsidiaries, operates an e-commerce platform in the People's Republic of China. It operates Pinduoduo, a mobile platform that offers a range of products, including apparel, shoes, bags, mother and childcare products, food and beverage, fresh produce, electronic appliances, furniture and household goods, cosmetics and other personal care items, sports and fitness items, and auto accessories. The company was formerly known as Walnut Street Group Holding Limited and changed its name to Pinduoduo Inc. in July 2018. Pinduoduo Inc. was incorporated in 2015 and is headquartered in Shanghai, the People's Republic of China.",Shanghai,86 21 5266 1300,,China,[],http://www.pinduoduo.com,1,No. 533 Loushanguan Road,Internet Retail,-0.05623,-0.03085,0.61114,26915028992,0.89,-0.06389,-4834617856,85.77,buy,40213224000,9166215168,134.53,96.22,,1.843,-0.02773,33,138.85,18.596,-0.05619,220.4,92181282816,12068547584,85970812928,73.543,CNY,70.039,1.205,1.9,NMS,Pinduoduo Inc.,Pinduoduo Inc.,America/New_York,EDT,False,-14400000,,EQUITY,,,finmb_572577901,feece1ce-41c4-3db9-b5ba-eb6db2cd7cd7,us_market,,0.559,,-9.934,,,-0.03,,1253289984,,,,50.052,23500645,0.0188,,1609372800,0.28919,-2651899904,-0.759,,,1.9224008,0.00182,1672444800,,1625011200,2.85,1626307200,522269491,1.41957,48026107904,2,,,,,,,1.4027035,1628812800,,,-3207.3335,,,25575974,,,94.95,95.73,113.222084,,0,,97,,6393228,94.95,96.694115,,95.73,6393228,,,,,,,94.32,USD,,7394478,,,,120591564800,,,8467968,94.32,96.41,1000,7394478,212.6,,,74.12,96.22,False,,900,97,96.22,https://logo.clearbit.com/pinduoduo.com,28th Floor Changning District,
MCHP,85224-6199,Technology,19500,"Microchip Technology Incorporated develops, manufactures, and sells semiconductor products for various embedded control applications in the Americas, Europe, and Asia. The company offers general purpose 8-bit, 16-bit, and 32-bit microcontrollers; 32-bit embedded microprocessors markets; and specialized microcontrollers for automotive, industrial, computing, communications, lighting, power supplies, motor control, human machine interface, security, wired connectivity, and wireless connectivity applications. It also provides development tools that enable system designers to program microcontroller products for specific applications; field-programmable gate array (FPGA) products; and analog, interface, mixed signal, and timing products comprising power management, linear, mixed-signal, high-voltage, thermal management, discrete diodes and metal oxide semiconductor field effect transistors (MOSFETS), radio frequency (RF), drivers, safety, security, timing, USB, Ethernet, wireless, and other interface products. In addition, the company offers memory products consisting of serial electrically erasable programmable read-only memory, serial flash memories, parallel flash memories, serial static random access memories, and serial electrically erasable random access memories for the production of very small footprint devices; and licenses its SuperFlash embedded flash and Smartbits one time programmable NVM technologies to foundries, integrated device manufacturers, and design partners for use in the manufacture of microcontroller products, gate array, RF, analog, and neuromorphic compute products that require embedded non-volatile memory, as well as provides engineering services. Further, it offers wafer foundry and assembly, and test subcontracting manufacturing services; and timing systems products, application specific integrated circuits, and aerospace products. Microchip Technology Incorporated was incorporated in 1989 and is headquartered in Chandler, Arizona.",Chandler,480 792 7200,AZ,United States,[],http://www.microchip.com,1,2355 West Chandler Boulevard,Semiconductors,0.40261,0.08399,0.6297,2044600064,0.198,0.20382,2294099968,155,buy,3378800000,1748762496,176,146.14,0.854,1.981,0.04359,23,180.26,155.173,0.08685,210,279700000,8565400064,5698100224,1.021,USD,21.411,1.176,2,NMS,Microchip Technology Incorporat,Microchip Technology Incorporated,America/New_York,EDT,True,-14400000,,EQUITY,,,finmb_31500,8cfbb7ea-d7da-3c80-a924-250bf7239709,us_market,,9.254,,22.986,,,8.54,,273531008,,,,19.512,4698210,0.0171,,1617148800,0.91489,478600000,1.29,,,7.4897504,0.02033,1680220800,,1625011200,2.29,1627603200,268416867,1.671397,52732276736,2,,1020902400,3:2,,,1.045,7.0152893,1630368000,1.14,,17.112411,,0.0197,5638558,,,149.25,149.81,151.01799,0.01001005,0.90559995,,149.82,,2003157,149.25,156.07442,1.494,149.81,2003157,,,1.75,1629331200,,,145.18,USD,113.28683,2269393,,,,39973822464,,,1998501,145.18,146.5,1300,2269393,166.67,,1.61,102.35,145,False,0.0108,1000,149.82,146.14,https://logo.clearbit.com/microchip.com,,
IDXX,04092,Healthcare,9300,"IDEXX Laboratories, Inc. develops, manufactures, and distributes products and services primarily for the companion animal veterinary, livestock and poultry, dairy, and water testing markets worldwide. The company operates through CAG; Water Quality Products; Livestock, Poultry and Dairy; and Other segments. It provides point-of-care veterinary diagnostic products, including instruments, consumables, and rapid assay test kits; veterinary reference laboratory diagnostic and consulting services; practice management and diagnostic imaging systems and services for veterinarians; and health monitoring, biological materials testing, and laboratory animal diagnostic instruments and services for biomedical research community. The company also offers diagnostic and health-monitoring products for livestock, poultry, and dairy; products that test water for various microbiological contaminants; and point-of-care electrolytes and blood gas analyzers and SARS-CoV-2 RT-PCR that are used in the human point-of-care medical diagnostics market; in-clinic chemistry, blood and urine chemistry, hematology, and SediVue Dx analyzers; SNAP rapid assays test kits. In addition, it provides Colilert, Colilert-18, and Colisure tests, which detect the presence of total coliforms and E. coli in water; Enterolert, Pseudalert, Filta-Max and Filta-Max xpress, Legiolert, and Quanti-Tray products; veterinary software and services for independent veterinary clinics and corporate groups. The company markets its products through marketing, customer service, sales, and technical service groups, as well as through independent distributors and other resellers. IDEXX Laboratories, Inc. was incorporated in 1983 and is headquartered in Westbrook, Maine.",Westbrook,207 556 0300,ME,United States,[],http://www.idexx.com,1,One IDEXX Drive,Diagnostics & Research,0.31625,0.23891,0.58827,770427008,0.296,0.28354,963472000,610,buy,1571040000,588369856,737.5,617.02,0.36,1.536,0.24693,6,717.5,135.34,1.4255201,770,232134000,1012648000,3046576128,2.729,USD,35.668,1.012,2.4,NMS,"IDEXX Laboratories, Inc.","IDEXX Laboratories, Inc.",America/New_York,EDT,True,-14400000,,EQUITY,,,finmb_29729,f576b05b-2a7f-3f70-9980-7b0489373c04,us_market,,17.837,,56.401,,,9.1,,85280704,,,,8.232,1258305,0.0148,,1609372800,0.87807,727848000,7.771,,,74.953835,0.00944,1672444800,,1625011200,3.26,1628812800,84212411,0.925218,54340829184,2,,1434412800,2:1,,,0.36,17.271816,1631664000,4.76,,67.8044,,0.0167,852506,,,623.01,623.73,606.9904,,0,,630.22,,403142,623.01,658.9038,,623.73,403142,,,,,,,611.74,USD,79.40034,209694,,,,52619902976,,,400676,611.74,643,800,209694,706.95,,,404.88,616.94,False,,800,630.22,617.02,https://logo.clearbit.com/idexx.com,,207 556 4346
AMT,02116,Real Estate,5618,"American Tower, one of the largest global REITs, is a leading independent owner, operator and developer of multitenant communications real estate with a portfolio of approximately 181,000 communications sites.",Boston,617-375-7500,MA,United States,[],http://www.americantower.com,1,116 Huntington Avenue,REIT—Specialty,0.6345,0.23402001,0.72589993,4174099968,0.083,0.39903,5207300096,270,buy,5814300000,3966037504,303.5,262.08,0.559,0.72,0.04666,22,305,806.176,0.42044997,345,1913600000,36695498752,8206900224,4.302,USD,18.484,0.636,2,NYQ,American Tower Corporation (REI,American Tower Corporation (REIT),America/New_York,EDT,True,-14400000,,EQUITY,,,finmb_24766,93037c7a-3d3b-3a0c-bac0-a08bc747c258,us_market,,19.411,,30.592,,,5.46,,454696000,,,,8.731,4198537,0.0092,,1609372800,0.90205,1920600064,4.31,,,30.01718,0.0031299999,1672444800,,1617148800,2.61,1620950400,443280636,0.231229,159304138752,2,,,,,,0.554,14.5203085,1623715200,3.24,,47.999996,,0.0106,3380228,,,266.11,266.08,268.36893,0.017624293,1.051,,266.135,,1511471,266.11,285.2853,4.69,266.08,1511471,,,5.08,1623888000,,,261.41,USD,60.807423,909384,,,,119166722048,,,1417871,261.41,262.9,1400,909384,303.72,,1.8,197.5,261.01,False,0.0182,900,266.135,262.08,https://logo.clearbit.com/americantower.com,11th Floor,617-375-7575
AMGN,91320-1799,Healthcare,24300,"Amgen Inc. discovers, develops, manufactures, and delivers human therapeutics worldwide. It focuses on inflammation, oncology/hematology, bone health, cardiovascular disease, nephrology and neuroscience areas. The company's products include Enbrel to treat plaque psoriasis, rheumatoid arthritis, and psoriatic arthritis; Neulasta that reduces the chance of infection due a low white blood cell count in patients cancer; Prolia to treat postmenopausal women with osteoporosis; Xgeva for skeletal-related events prevention; Otezla for the treatment of adult patients with plaque psoriasis, psoriatic arthritis, and oral ulcers associated with BehÃ§et's disease; Aranesp to treat a lower-than-normal number of red blood cells and anemia; KYPROLIS to treat patients with relapsed or refractory multiple myeloma; and Repatha, which reduces the risks of myocardial infarction, stroke, and coronary revascularization. It also markets Nplate, Vectibix, MVASI, Parsabiv, EPOGEN, KANJINTI, BLINCYTO, Aimovig, EVENITY, AMGEVITATM, Sensipar/Mimpara, NEUPOGEN, IMLYGIC, Corlanor, and AVSOLA. Amgen Inc. serves healthcare providers, including physicians or their clinics, dialysis centers, hospitals, and pharmacies. It distributes its products through pharmaceutical wholesale distributors, as well as direct-to-consumer channels. The company has collaboration agreements with Novartis Pharma AG; UCB; Bayer HealthCare LLC; BeiGene, Ltd.; Eli Lilly and Company; and Datos Health. It also has an agreement with Kyowa Kirin Co., Ltd. to jointly develop and commercialize KHK4083, a Phase 3-ready anti-OX40 fully human monoclonal antibody for the treatment of atopic dermatitis and other autoimmune diseases. Amgen Inc. was founded in 1980 and is headquartered in Thousand Oaks, California.",Thousand Oaks,805 447 1000,CA,United States,[],http://www.amgen.com,1,One Amgen Center Drive,Drug Manufacturers—General,0.48740003,0.22547,0.75337,9555999744,0.052,0.35756,12421000192,185,buy,19265000000,8359750144,250.5,208.95,-0.735,1.309,0.091280006,22,250,397.502,0.60785,298,8081999872,32782000128,25483999232,14.233,USD,44.014,0.861,2.5,NMS,Amgen Inc.,Amgen Inc.,America/New_York,EDT,True,-14400000,,EQUITY,,,finmb_24816,9376b97e-b428-3231-ba0b-142b20481cb4,us_market,,5.83,,11.961,,,17.83,,574553984,,,,16.225,11212944,0.0197,,1609372800,0.77835,5745999872,12.073,,,12.878274,0.00199,1672444800,,1625011200,4.3,1627603200,566762076,0.672489,148565639168,2,,943228800,2:1,,,-0.743,4.710919,1630368000,2.31,,11.719013,,0.0198,10713887,,,209.12,210.125,237.35454,0.03136955,0.6829,,210.18,,2724171,209.12,217.39235,6.56,210.125,2724171,,,7.04,1629072000,,,207.6487,USD,17.307215,2350037,,,,120053055488,,,2479495,207.6487,210.01,800,2350037,276.69,,2.68,207.6487,208.8,False,0.0323,800,210.18,208.95,https://logo.clearbit.com/amgen.com,,805 447 1010
