TXN,75243,Technology,30000,"Texas Instruments Incorporated designs, manufactures, and sells semiconductors to electronics designers and manufacturers worldwide. It operates in two segments, Analog and Embedded Processing. The Analog segment offers power products to manage power requirements in various levels using battery management solutions, DC/DC switching regulators, AC/DC and isolated controllers and converters, power switches, linear regulators, voltage supervisors, voltage references, and lighting products. This segment also provides signal chain products that sense, condition, and measure signals to allow information to be transferred or converted for further processing and control for use in end markets, including amplifiers, data converters, interface products, motor drives, clocks, and sensing products.; and high volume products comprising integrated analog and standard products, which are primarily for sale into personal electronics, industrial, and automotive markets. The Embedded Processing segment offers connected microcontrollers, such as microcontrollers, microcontrollers with integrated wireless capabilities, and stand-alone wireless connectivity solutions that are used in electronic equipment; digital signal processors for mathematical computations; and applications processors for specific computing activity. This segment offers products for use in various markets, such as industrial, automotive, Personal electronics, communications equipment, enterprise systems, and calculators and other. The company also provides DLP products primarily for use in projectors to create high-definition images; calculators; and application-specific integrated circuits. Texas Instruments Incorporated markets and sells its semiconductor products through direct sales and distributors, as well as through its website. The company was founded in 1930 and is headquartered in Dallas, Texas.",Dallas,214 479 3773,TX,United States,[],http://www.ti.com,1,12500 TI Boulevard,Semiconductors,0.49517,0.4012,0.65462995,7538999808,0.414,0.45215,8300000256,155,buy,9269000000,4601999872,200,195.24,0.385,5.078,0.24899,31,204.03,56.048,0.71554,240,7390000128,6250999808,16762000384,8.005,USD,18.2,4.08,2.5,NMS,Texas Instruments Incorporated,Texas Instruments Incorporated,America/New_York,EDT,True,-14400000,,EQUITY,,,finmb_140283,a06516ec-4e7b-3444-b29a-1e4ac0c3f046,us_market,,10.983,,22.181,,,7.84,,923523968,,,,11.011,13625372,0.0148,,1609372800,0.85417,6696000000,6.603,,,17.731361,0.00244,1672444800,,1625011200,4.37,1628812800,921640514,1.005458,184103075840,2,,959040000,2:1,,,0.399,10.756999,1631664000,2.4,,24.90306,,0.0148,14021338,,,195.31,196.18,189.02518,0.019661052,0.5523,,196.3604,,3228842,195.31,192.75206,3.84,196.18,3228842,,,4.6,1635465600,,,194.0044,USD,29.568378,2574223,,,,180308819968,,,3554989,194.0044,196.44,1000,2574223,200.92,,2.41,141.33,194,False,0.0229,800,196.3604,195.24,https://logo.clearbit.com/ti.com,,
NFLX,95032,Communication Services,9400,"Netflix, Inc. provides entertainment services. It offers TV series, documentaries, and feature films across various genres and languages. The company provides members the ability to receive streaming content through a host of Internet-connected devices, including TVs, digital video players, television set-top boxes, and mobile devices. It also provides DVDs-by-mail membership services. The company has approximately 204 million paid members in 190 countries. Netflix, Inc. was founded in 1997 and is headquartered in Los Gatos, California.",Los Gatos,408-540-3700,CA,United States,[],http://www.netflix.com,1,100 Winchester Circle,Entertainment,0.21635,0.14243001,0.41098,2944431104,0.242,0.21169001,5709822976,340,buy,9719737000,13543857152,622.5,632.66,1.389,1.27,0.092889994,42,615.81,137.684,0.35307,971,8403704832,17739319296,26391646208,18.954,USD,59.724,1.157,2.1,NMS,"Netflix, Inc.","Netflix, Inc.",America/New_York,EDT,True,-14400000,,EQUITY,,,finmb_32012,1a1cddac-4d41-374d-b202-739314177b67,us_market,,9.228,,42.652,,,12.96,,443403008,,,,29.059,8930701,0.0201,,1609372800,0.82088,3759043072,8.263,,,21.771566,0.0149,1672444800,,1617148800,2.92,1620950400,437544368,0.75326,243535331328,2,,1436918400,7:1,,,1.407,10.629248,1623715200,1.31,,48.816357,,0.020499999,9122498,,,631.85,634.165,534.23724,,0,,643.78,,5234571,631.85,590.0103,,634.165,5234571,,,,,,,630.86,USD,76.565414,3272093,,,,280523341824,,,3562198,630.86,632.38,900,3272093,646.84,,,463.41,631.6,False,,1400,643.78,632.66,https://logo.clearbit.com/netflix.com,,
SE,138522,Communication Services,33800,"Sea Limited, together with its subsidiaries, engages in the digital entertainment, e-commerce, and digital financial service businesses in Southeast Asia, Latin America, rest of Asia, and internationally. It provides Garena digital entertainment platform for users to access mobile and PC online games, as well as eSports operations; and access to other entertainment content, such as livestreaming of gameplay and social features, such as user chat and online forums. The company also operates Shopee e-commerce platform, a mobile-centric marketplace that offers integrated payment and logistics infrastructure and seller services. In addition, it offers SeaMoney digital financial services to individuals and businesses, including mobile wallet and payment services AirPay, ShopeePay, SPayLater, and other digital financial services brands; and payment processing services for Shopee. The company was formerly known as Garena Interactive Holding Limited and changed its name to Sea Limited in April 2017. Sea Limited was incorporated in 2009 and is headquartered in Singapore.",Singapore,65 6270 8100,,Singapore,[],http://www.sea.com,1,1 Fusionopolis Place,Electronic Gaming & Multimedia,-0.16414,-0.26378,0.36898997,932147968,1.586,-0.19633,-1119906944,296.95,buy,1348905000,115271872,351,323.28,,1.597,-0.09237,20,354.79,47.112,-0.80403,410,5607523840,1695516032,6822901760,10.488,USD,13.521,1.02,1.7,NYQ,Sea Limited,Sea Limited,America/New_York,EDT,False,-14400000,,EQUITY,,,finmb_426181371,f003c44d-eab6-39aa-aedf-aff864c77402,us_market,,24.143,,-147.091,,,-1.13,,524433984,,,,6.49,18444912,0.0334,,1609372800,0.69753,-1799714048,-3.587,,,49.81202,0.049640004,1672444800,,1625011200,3.98,1628812800,307630503,1.339847,164728176640,2,,,,,,,24.84852,1631664000,,,-286.0885,,,20881666,,,324.25,329.8,279.13977,,0,,332.56,,2511242,324.25,329.31705,,329.8,2511242,,,,,,,322,USD,,1774564,,,,169539010560,,,3353545,322,323.14,900,1774564,359.84,,,155.1,321.5,False,,1100,332.56,323.28,https://logo.clearbit.com/sea.com,"No. 17-10, Galaxis",
ADBE,95110-2704,Technology,22516,"Adobe Inc. operates as a diversified software company worldwide. Its Digital Media segment provides tools and solutions that enable individuals, teams, and enterprises to create, publish, promote, and monetize their digital content. Its flagship product is Creative Cloud, a subscription service that allows customer to download and access the latest versions of its creative products. This segment serves content creators, experience designers, app developers, enthusiasts, students, social media users, and creative professionals; and marketing departments and agencies, companies, and publishers. The company's Digital Experience segment offers products, services, and solutions for creating, managing, executing, measuring, monetizing, and optimizing customer experiences from analytics to commerce. This segment serves marketers, advertisers, agencies, publishers, merchandisers, merchants, web analysts, data scientists, developers, marketing executives, information management and technology executives, product development executives, and sales and support executives. Its Publishing and Advertising segment offers products and services, such as e-learning solutions, technical document publishing, web conferencing, document and forms platform, web application development, and high-end printing, as well as publishing needs of technical and business, and original equipment manufacturers (OEMs) printing businesses. The company offers its products and services directly to enterprise customers through its sales force and local field offices, as well as to end users through app stores and through its website at adobe.com. It also distributes products and services through a network of distributors, value-added resellers, systems integrators, software vendors and developers, retailers, and OEMs. The company was formerly known as Adobe Systems Incorporated and changed its name to Adobe Inc. in October 2018. The company was founded in 1982 and is headquartered in San Jose, California.",San Jose,408 536 6000,CA,United States,[],http://www.adobe.com,1,345 Park Avenue,Software—Infrastructure,0.39815,0.38794,0.87865996,6977999872,0.226,0.3575,5728999936,550,buy,11146000000,5496374784,640,576.86,0.022,1.315,0.13627,25,646.31,33.88,0.45138,750,5768000000,4693000192,14389000192,12.107,USD,30.027,1.179,1.7,NMS,Adobe Inc.,Adobe Inc.,America/New_York,EDT,True,-14400000,,EQUITY,,,finmb_24321,bccf427f-30a1-3360-9ce4-c77a8198c902,us_market,,20.95,,52.617,,,14.03,,478000000,,,,28.979,4778345,0.01,,1606435200,0.85213995,5582000128,11.538,,,19.906137,0.0031,1669507200,,1622764800,2.95,1625011200,474856464,0.964497,301443776512,2,,1116892800,2:1,,,0.015,19.163185,1627603200,2.94,,41.11618,,0.0101,4535876,,,578.96,581.3,568.1095,,0,,583.61,,2673728,578.96,631.0624,,581.3,2673728,,,,1111622400,,,575.52,USD,49.996532,2051019,,,,275739082752,,,1878503,575.52,576.82,1400,2051019,673.88,,,420.78,576.01,False,,900,583.61,576.86,https://logo.clearbit.com/adobe.com,,408 537 6000
SHOP,K2P 2L8,Technology,7000,"Shopify Inc., a commerce company, provides a commerce platform and services in Canada, the United States, the United Kingdom, Australia, Latin America, and internationally. The company's platform provides merchants to run their business in various sales channels, including web and mobile storefronts, physical retail locations, pop-up shops, social media storefronts, native mobile apps, buy buttons, and marketplaces; and enables to manage products and inventory, process orders and payments, fulfill and ship orders, new buyers and build customer relationships, source products, leverage analytics and reporting, and access financing. It also sells custom themes and apps, and registration of domain names. The company was formerly known as Jaded Pixel Technologies Inc. and changed its name to Shopify Inc. in November 2011. Shopify Inc. was incorporated in 2004 and is headquartered in Ottawa, Canada.",Ottawa,613 241 2828,ON,Canada,[],http://www.shopify.com,1,151 O'Connor Street,Software—Application,0.13797,0.63647,0.54217,536827008,0.567,0.12312999,531630016,1300,buy,1541520000,487217760,1700,1378.03,22.797,16.553,0.03477,32,1703.52,10.64,0.33255002,2000,7755386880,1076795008,3853241088,62.161,USD,31.421,15.586,2.1,NYQ,Shopify Inc.,Shopify Inc.,America/New_York,EDT,False,-14400000,,EQUITY,,,finmb_84159238,7e0e6171-361a-368a-bdf8-43969340dbb4,us_market,,46.248,,335.204,,,4.99,,112832000,,,,73.531,1575800,0.0126,,1609372800,0.7066,2452477952,12.788,,,18.740805,0.00287,1672444800,,1625011200,1.12,1625011200,112958323,1.450779,178204606464,2,,,,,,23.421,44.10851,1627603200,7.54,,276.15833,,0.024400001,1690427,,,1398.5,1417.78,1352.9772,,0,,1429,,902242,1398.5,1458.2542,,1417.78,902242,,,,,,,1372.3572,USD,107.75962,886392,,,,169960718336,,,997192,1372.3572,1380,1800,886392,1650,,,875,1372,False,,1400,1429,1378.03,https://logo.clearbit.com/shopify.com,Ground floor,
TSM,300-78,Technology,,"Taiwan Semiconductor Manufacturing Company Limited manufactures and sells integrated circuits and semiconductors. It also offers customer service, account management, and engineering services. The company serves customers in computer, communications, consumer, and industrial and standard segments in North America, Europe, Japan, China, and South Korea. Taiwan Semiconductor Manufacturing Company Limited was founded in 1987 and is headquartered in HsinChu, Taiwan.",Hsinchu City,886 3 563 6688,,Taiwan,[],http://www.tsmc.com,1,Hsinchu Science Park,Semiconductors,0.68267,0.38149,0.52436,,0.198,0.41559,991590809600,105,buy,711146502000,,139,110.04,0.112,1.883,0.13617,8,141.54,20.744,0.2984,204,870840008704,413639999488,1452514476032,167.921,TWD,280.08,1.62,2,NYQ,Taiwan Semiconductor Manufactur,Taiwan Semiconductor Manufacturing Company Limited,America/New_York,EDT,False,-14400000,,EQUITY,,,finmb_380075,a22510a4-756f-3424-8b07-71b132611395,us_market,,0.101,,0.147,,,4.55,,5186079744,,,,373.875,17928461,0.0034999999,,1609372800,0.17504999,554125950976,3.725,,,0.29432297,6.0000002e-05,1672444800,,1625011200,2.03,1625011200,4835633840,0.997789,146242961408,2,,1247616000,1005:1000,,,0.112,0.3928885,1627603200,3.3,,24.184614,,,14961892,,,110.83,110.98,116.82892,0.09248398,0.48619998,,111.07,,6973628,110.83,116.695,10.25,110.98,6973628,,,1.78,1623888000,,,109.51,USD,29.540941,5068721,,,,570676215808,,,7919123,109.51,110.3,1000,5068721,142.2,,2.91,83.16,109.98,False,0.0153,800,111.07,110.04,https://logo.clearbit.com/tsmc.com,"No. 8, Li-Hsin Road 6",886 3 563 7000
MDT,2,Healthcare,90000,"Medtronic plc develops, manufactures, distributes, and sells device-based medical therapies to hospitals, physicians, clinicians, and patients worldwide. It operates through four segments: Cardiovascular Portfolio, Neuroscience Portfolio, Medical Surgical Portfolio, and Diabetes Operating Unit. The Cardiovascular Portfolio segment offers implantable cardiac pacemakers, cardioverter defibrillators, and cardiac resynchronization therapy devices; AF ablation products; insertable cardiac monitor systems; mechanical circulatory support; TYRX products; and remote monitoring and patient-centered software. It also provides aortic valves; percutaneous coronary intervention stents, surgical valve replacement and repair products, endovascular stent grafts, percutaneous angioplasty balloons, and products to treat superficial venous diseases in the lower extremities. The Medical Surgical Portfolio segment offers surgical products, including surgical stapling devices, vessel sealing instruments, wound closure, electrosurgery products, surgical artificial intelligence and robotic-assisted surgery products, hernia mechanical devices, mesh implants, gynecology and lung products, and various therapies to treat diseases. The Neuroscience Portfolio segment offers products for spinal surgeons; neurosurgeons; neurologists; pain management specialists; anesthesiologists; orthopedic surgeons; urologists; urogynecologists; interventional radiologists; ear, nose, and throat specialists; and systems that incorporate energy surgical instruments. It also provides image-guided surgery and intra-operative imaging systems and robotic guidance systems used in robot assisted spine procedures; and therapies for vasculature in and around the brain. The Diabetes Operating Unit segment offers insulin pumps and consumables, and continuous glucose monitoring systems. The company was founded in 1949 and is headquartered in Dublin, Ireland.",Dublin,353 1 438 1700,,Ireland,[],http://www.medtronic.com,1,20 On Hatch,Medical Devices,0.28974,0.12286,0.66953003,7254000128,0.227,0.20416,9155000320,129,buy,19762000000,5276000256,148,125.27,0.556,2.889,0.043420002,27,145.56,50.255,0.07655,155,10595000320,25963999232,31597000704,7.873,USD,23.483,2.064,1.9,NYQ,Medtronic plc.,Medtronic plc,America/New_York,EDT,True,-14400000,,EQUITY,,,finmb_31348,c9b9ae1b-4267-324d-8899-95d8371bbb3b,us_market,,6.016,,20.764,,,6.29,,1345400064,,,,38.225,10620070,0.007900001,,1619740800,0.83219004,3881999872,2.66,,,3.2771747,0.00229,1682812800,,1627603200,2.58,1627603200,1343818176,0.813864,190098554880,2,,938390400,2:1,,,0.567,5.3866854,1630368000,1.74,,19.91574,,0.007900001,11102082,,,126.83,127,127.03122,0.018292202,0.8287,,127.26,,4275042,126.83,130.29411,2.32,127,4275042,,,2.52,1632355200,,,125.06,USD,47.093983,3848237,,,,170203103232,,,3848839,125.06,125.13,800,3848237,135.89,,2.08,98.94,123,False,0.0194,1000,127.26,125.27,https://logo.clearbit.com/medtronic.com,Lower Hatch Street,
CRM,94105,Technology,59895,"salesforce.com, inc. develops enterprise cloud computing solutions with a focus on customer relationship management worldwide. The company offers Sales Cloud to store data, monitor leads and progress, forecast opportunities, and gain insights through analytics and relationship intelligence, as well as deliver quotes, contracts, and invoices. It also provides Service Cloud, which enables companies to deliver personalized customer service and support, as well as a field service solution that enables companies to connect agents, dispatchers, and mobile employees through a centralized platform, which helps to schedule and dispatch work, and track and manage jobs in real-time. In addition, the company offers Marketing Cloud to plan, personalize, and optimize one-to-one customer marketing interactions; and Commerce Cloud, which enables companies to enhance engagement, conversion, revenue, and loyalty from their customers. Further, it provides Customer 360 Platform that offers no-code to pro-code Platform-as-a-Service tools for building, securing, integrating, and managing the business apps; MuleSoft Anypoint Platform enables customers to connect any system, application, data, or device; Quip collaboration platform, which combines documents, spreadsheets, apps, and chat with live CRM data; and Tableau and Einstein Analytics, provides analytical technology to customers. Additionally, the company offers various solutions for financial services, healthcare and life sciences, manufacturing, consumer goods, government, and philanthropy. The company also provides professional services and education services, including instructor-led and online courses; and support and adoption programs. It provides its services through direct sales; and consulting firms, systems integrators, and other partners. Salesforce and Siemens has a strategic partnership. The company was founded in 1999 and is headquartered in San Francisco, California.",San Francisco,415 901 7000,CA,United States,[],http://www.salesforce.com,1,Salesforce Tower,Software—Application,0.15553,0.19875,0.74322,6169999872,0.226,0.04246,3476000000,211.86,buy,15814000000,8204250112,300,272.48,3.545,1.334,0.01001,43,297.39,14.76,0.11517999,350,15022999552,6282999808,22350000128,16.224,USD,24.446,1.188,1.9,NYQ,Salesforce.com Inc,"salesforce.com, inc.",America/New_York,EDT,True,-14400000,,EQUITY,,,finmb_122917,01d3fcca-fdd3-37b7-b601-1bfd3a695ce7,us_market,,9.629,,61.911,,,4.15,,922233024,,,,45.15,22712479,0.024500001,,1612051200,0.79046,4441999872,4.38,,,6.0349946,0.03612,1675123200,,1619740800,3.63,1619740800,892775120,1.091304,215203840000,2,,1366243200,4:1,,,3.737,11.243403,1622160000,5.79,,65.65783,,0.0254,22624599,,,274.58,275.54,242.2292,,0,,276.92,,4746614,274.58,266.15265,,275.54,4746614,,,,,,,272.27,USD,62.210045,2683286,,,,251290058752,,,6151915,272.27,272.48,800,2683286,286.36,,,201.51,272.45,False,,1000,276.92,272.48,https://logo.clearbit.com/salesforce.com,3rd Floor 415 Mission Street,415 901 7040
XOM,75039-2298,Energy,72000,"Exxon Mobil Corporation explores for and produces crude oil and natural gas in the United States and internationally. It operates through Upstream, Downstream, and Chemical segments. The company is also involved in the manufacture, trade, transport, and sale of crude oil, natural gas, petroleum products, petrochemicals, and other specialty products; and manufactures and sells petrochemicals, including olefins, polyolefins, aromatics, and various other petrochemicals. As of December 31, 2020, it had approximately 22,239 net operated wells with proved reserves. The company was founded in 1870 and is based in Irving, Texas.",Irving,972-940-6000,TX,United States,[],http://corporate.exxonmobil.com,1,5959 Las Colinas Boulevard,Oil & Gas Integrated,0.113249995,-0.061750002,0.31561002,27307999232,1.04,0.02937,24448999424,40,hold,57157000000,13676125184,65.7,62.18,,0.849,0.01134,28,66.25,36.611,-0.07788,90,3464999936,60612001792,215878991872,0.818,USD,50.522,0.514,2.7,NYQ,Exxon Mobil Corporation,Exxon Mobil Corporation,America/New_York,EDT,True,-14400000,,EQUITY,,,finmb_406338,623c29c3-4307-34c2-840f-d89284dd4857,us_market,,1.404,,12.393,,,4.49,,4233540096,,,,37.079,41211862,0.0097,,1609372800,0.53446,-13329999872,-4.471,,,1.6769601,0.00117,1672444800,,1625011200,2.23,1627603200,4224545428,1.419759,302989606912,2,,995500800,2:1,,,,1.219394,1630368000,12.9,,13.848553,,0.0097,33224876,,,60.66,61.25,58.391872,0.05736894,,,62.415,,26606857,60.66,56.657646,3.48,61.25,26606857,,,3.48,1628726400,,,61.25,USD,,21631373,,,,263241531392,,,21253157,61.25,62.23,3000,21631373,64.93,,5.18,31.11,62.15,False,0.0638,3000,62.415,62.18,https://logo.clearbit.com/corporate.exxonmobil.com,,972-940-6143
ADI,01887,Technology,15900,"Analog Devices, Inc. designs, manufactures, tests, and markets integrated circuits (ICs), software, and subsystems that leverage analog, mixed-signal, and digital signal processing technologies. The company offers data converter products, which translate real-world analog signals into digital data, as well as translates digital data into analog signals; high-performance amplifiers to condition analog signals; and radio frequency and microwave ICs to support cellular infrastructure. It also provides power management and reference products for power management and conversion applications in the automotive, communications, industrial, and high-end consumer markets; and microelectromechanical systems technology solutions, including accelerometers used to sense acceleration, gyroscopes to sense rotation, and inertial measurement units to sense multiple degrees of freedom, as well as isolators. In addition, the company offers digital signal processing and system products for high-speed numeric calculations. The company serves clients in the industrial, automotive, consumer, and communications markets through a direct sales force, third-party distributors, and independent sales representatives in the United States, the rest of North and South America, Europe, Japan, China, and rest of Asia, as well as through its Website. Analog Devices, Inc. has a strategic agreement with BraveHeart Wireless Inc. to collaborate on a remote patient monitoring system. The company was founded in 1965 and is headquartered in Wilmington, Massachusetts.",Wilmington,781 935 5565,MA,United States,[],http://www.analog.com,1,One Analog Way,Semiconductors,0.45013002,0.26153,0.68044,2466942976,0.208,0.32747,2928112896,165,buy,3690478000,2059701120,193.5,168.62,0.392,1.106,0.06158,22,191,43.466,0.14152999,210,1480701056,5330696192,6505013248,4.021,USD,17.631,0.825,1.8,NMS,"Analog Devices, Inc.","Analog Devices, Inc.",America/New_York,EDT,True,-14400000,,EQUITY,,,finmb_251411,d98d9168-137c-3f9c-afb4-adc56ba055f1,us_market,,10.446,,23.206,,,6.96,,368827008,,,,32.989,12488061,0.0232,,1604102400,0.70572996,1701261056,4.19,,,5.111401,0.00215,1667174400,,1627689600,2.22,1627603200,366719391,1.213973,67948748800,2,,953164800,2:1,,,0.388,9.560566,1630368000,1.59,,24.22701,,0.0233,42427238,,,166.98,168.48,163.64008,0.015690502,0.5733,,168.95,,3531485,166.98,168.61853,2.62,168.48,3531485,,,2.76,1629936000,,,166.68,USD,40.243435,3145920,,,,62191607808,,,4622598,166.68,172.75,800,3145920,178.84,,1.98,115.64,166.56,False,0.0159,800,168.95,168.62,https://logo.clearbit.com/analog.com,,
